{
  "$schema": "https://json-schema.org/draft/2020-12/schema",
  "type": "array",
  "items": {
    "type": "object",
    "properties": {
      "geo": { "type": "string", "pattern": "^(AR|AR-[A-Z])$" },
      "year": { "type": "integer" },
      "age": { "type": "integer", "minimum": 0, "maximum": 100 },
      "shape_f": {
        "anyOf": [
          { "type": "number", "minimum": 0 },
          { "type": "null" }
        ]
      },
      "female_share": {
        "anyOf": [
          { "type": "number", "minimum": 0, "maximum": 1 },
          { "type": "null" }
        ]
      },
      "tfr": {
        "anyOf": [
          { "type": "number", "minimum": 0 },
          { "type": "null" }
        ]
      },
      "source": { "type": "string", "minLength": 1 },
      "retrieved_at": { "type": "string", "format": "date" },
      "note": { "type": "string" }
    },
    "required": [
      "geo",
      "year",
      "age",
      "shape_f",
      "female_share",
      "tfr",
      "source",
      "retrieved_at"
    ],
    "additionalProperties": false,
    "allOf": [
      {
        "if": { "properties": { "shape_f": { "type": "null" } } },
        "then": { "required": ["note"] }
      },
      {
        "if": { "properties": { "female_share": { "type": "null" } } },
        "then": { "required": ["note"] }
      },
      {
        "if": { "properties": { "tfr": { "type": "null" } } },
        "then": { "required": ["note"] }
      }
    ]
  }
}
